サンダー,でんげき,でんき,ひこう,伝説の鳥ポケモンの一つ。飛ぶときにバチバチと何かのはじけるような音がする。,http://pokemonapi.net/images/145.gif
ファイヤー,かえん,ほのお,ひこう,伝説の鳥ポケモンの一つ。オレンジ色の燃えるような羽が見るものを圧倒する。,http://pokemonapi.net/images/146.gif
ミニリュウ,ドラゴン,ドラゴン,なし,子供でも身長は2メートル以上。脱皮を繰り返して大きくなる。,http://pokemonapi.net/images/147.gif
ハクリュー,ドラゴン,ドラゴン,なし,海や湖などに住むという羽を持たないがたまに空を飛ぶ姿が目撃される。,http://pokemonapi.net/images/148.gif
カイリュー,ドラゴン,ドラゴン,ひこう,大きな体格で空を飛ぶ。地球を約16時間で1周してしまう。,http://pokemonapi.net/images/149.gif
ミュウツー,いでんし,エスパー,なし,研究のために遺伝子をどんどん組み替えていった結果凶暴なポケモンになった。,http://pokemonapi.net/images/150.gif
ミュウ,しんしゅ,エスパー,なし,南アメリカに生息する絶滅したはずのポケモン。知能が高く何でも覚える。,http://pokemonapi.net/images/151.gif
